Entry,Reviewed,Entry Name,Protein names,Gene Names,Organism,Length,Gene Names (primary),Gene Names (ORF),Gene Names (synonym)
H9L427,reviewed,BIPA_SALTY,"50S ribosomal subunit assembly factor BipA, EC 3.6.5.- (GTP-binding protein BipA) (Ribosome-dependent GTPase BipA)",bipA STM4009,Salmonella typhimurium (strain LT2 / SGSC1412 / ATCC 700720),607,bipA,,
H9L478,reviewed,PDUJ_SALTY,"Bacterial microcompartment shell protein PduJ (Bacterial microcompartment protein homohexamer, BMC-H) (Propanediol utilization protein PduJ)",pduJ STM2045,Salmonella typhimurium (strain LT2 / SGSC1412 / ATCC 700720),91,pduJ,,
O06961,reviewed,TDCD_SALTY,"Propionate kinase, EC 2.7.2.15",tdcD oxd-2 STM3242,Salmonella typhimurium (strain LT2 / SGSC1412 / ATCC 700720),402,tdcD,,oxd-2
O30916,reviewed,SOPB_SALTY,"Inositol phosphate phosphatase SopB, EC 3.1.3.- (Effector protein SopB)",sopB sigD STM1091,Salmonella typhimurium (strain LT2 / SGSC1412 / ATCC 700720),561,sopB,,sigD
O31041,reviewed,PDUD_SALTY,"Propanediol dehydratase medium subunit, EC 4.2.1.28 (Diol dehydratase medium subunit, DDH medium subunit) (Propanediol utilization protein PduD)",pduD STM2041,Salmonella typhimurium (strain LT2 / SGSC1412 / ATCC 700720),224,pduD,,
O31042,reviewed,PDUE_SALTY,"Propanediol dehydratase small subunit, EC 4.2.1.28 (Diol dehydratase small subunit, DDH small subunit) (Propanediol utilization protein PduE)",pduE STM2042,Salmonella typhimurium (strain LT2 / SGSC1412 / ATCC 700720),173,pduE,,
O52325,reviewed,ARNA_SALTY,"Bifunctional polymyxin resistance protein ArnA [Includes: UDP-4-amino-4-deoxy-L-arabinose formyltransferase, EC 2.1.2.13 (ArnAFT) (UDP-L-Ara4N formyltransferase); UDP-glucuronic acid oxidase, UDP-4-keto-hexauronic acid decarboxylating, EC 1.1.1.305 (ArnADH) (UDP-GlcUA decarboxylase) (UDP-glucuronic acid dehydrogenase) ]",arnA pbgP3 pmrI STM2299,Salmonella typhimurium (strain LT2 / SGSC1412 / ATCC 700720),660,arnA,,pbgP3 pmrI
P00898,reviewed,TRPE_SALTY,"Anthranilate synthase component 1, AS, ASI, EC 4.1.3.27",trpE STM1723,Salmonella typhimurium (strain LT2 / SGSC1412 / ATCC 700720),520,trpE,,
P00905,reviewed,TRPGD_SALTY,"Bifunctional protein TrpGD [Includes: Anthranilate synthase component 2, AS, ASII, EC 4.1.3.27 (Anthranilate synthase, glutamine amidotransferase component); Anthranilate phosphoribosyltransferase, EC 2.4.2.18 ]",trpGD trpD STM1724,Salmonella typhimurium (strain LT2 / SGSC1412 / ATCC 700720),531,trpGD,,trpD
P04042,reviewed,CHEB_SALTY,"Protein-glutamate methylesterase/protein-glutamine glutaminase, EC 3.1.1.61, EC 3.5.1.44",cheB STM1917,Salmonella typhimurium (strain LT2 / SGSC1412 / ATCC 700720),349,cheB,,
P05989,reviewed,ILVC_SALTY,"Ketol-acid reductoisomerase (NADP(+)), KARI, EC 1.1.1.86 (Acetohydroxy-acid isomeroreductase, AHIR) (Alpha-keto-beta-hydroxylacyl reductoisomerase) (Ketol-acid reductoisomerase type 2) (Ketol-acid reductoisomerase type II)",ilvC STM3909 STMD1.81,Salmonella typhimurium (strain LT2 / SGSC1412 / ATCC 700720),491,ilvC,STMD1.81,
P07800,reviewed,CHEZ_SALTY,"Protein phosphatase CheZ, EC 3.1.3.- (Chemotaxis protein CheZ)",cheZ STM1915,Salmonella typhimurium (strain LT2 / SGSC1412 / ATCC 700720),214,cheZ,,
P08870,reviewed,PYRE_SALTY,"Orotate phosphoribosyltransferase, OPRT, OPRTase, EC 2.4.2.10",pyrE STM3733,Salmonella typhimurium (strain LT2 / SGSC1412 / ATCC 700720),213,pyrE,,
P0A1A5,reviewed,ILVE_SALTY,"Branched-chain-amino-acid aminotransferase, BCAT, EC 2.6.1.42 (Transaminase B)",ilvE STM3903 STMD1.89,Salmonella typhimurium (strain LT2 / SGSC1412 / ATCC 700720),309,ilvE,STMD1.89,
P0A1B9,reviewed,SCTN1_SALTY,"SPI-1 type 3 secretion system ATPase, T3SS-1 ATPase, EC 7.4.2.8 (Invasion protein InvC)",sctN1 invC spaI spaL STM2894,Salmonella typhimurium (strain LT2 / SGSC1412 / ATCC 700720),431,sctN1,,invC spaI spaL
P0A1C7,reviewed,PDUA_SALTY,"Bacterial microcompartment shell protein PduA (Bacterial microcompartment protein homohexamer, BMC-H) (Propanediol utilization protein PduA)",pduA STM2038,Salmonella typhimurium (strain LT2 / SGSC1412 / ATCC 700720),94,pduA,,
P0A1C9,reviewed,EUTL_SALTY,Bacterial microcompartment shell protein EutL (BMC-T) (Ethanolamine utilization protein EutL),eutL STM2456,Salmonella typhimurium (strain LT2 / SGSC1412 / ATCC 700720),219,eutL,,
P0A1E1,reviewed,HEMN_SALTY,"Oxygen-independent coproporphyrinogen III oxidase, CPO, EC 1.3.98.3 (Coproporphyrinogen III dehydrogenase, CPDH)",hemN STM4004,Salmonella typhimurium (strain LT2 / SGSC1412 / ATCC 700720),457,hemN,,
P0A1E3,reviewed,CYSK_SALTY,"Cysteine synthase A, CSase A, EC 2.5.1.47 (O-acetylserine (thiol)-lyase A, OAS-TL A) (O-acetylserine sulfhydrylase A)",cysK STM2430,Salmonella typhimurium (strain LT2 / SGSC1412 / ATCC 700720),323,cysK,,
P0A1F8,reviewed,DHAS_SALTY,"Aspartate-semialdehyde dehydrogenase, ASA dehydrogenase, ASADH, EC 1.2.1.11 (Aspartate-beta-semialdehyde dehydrogenase)",asd STM3539,Salmonella typhimurium (strain LT2 / SGSC1412 / ATCC 700720),368,asd,,
P0A1P6,reviewed,GLN1B_SALTY,"Glutamine synthetase, GS, EC 6.3.1.2 (Glutamate--ammonia ligase) (Glutamine synthetase I beta, GSI beta)",glnA STM4007,Salmonella typhimurium (strain LT2 / SGSC1412 / ATCC 700720),469,glnA,,
P0A1S2,reviewed,HNS_SALTY,DNA-binding protein H-NS (Histone-like protein HLP-II) (Protein B1) (Protein H1),hns hnsA osmZ STM1751,Salmonella typhimurium (strain LT2 / SGSC1412 / ATCC 700720),137,hns,,hnsA osmZ
P0A1V6,reviewed,KPRS_SALTY,"Ribose-phosphate pyrophosphokinase, RPPK, EC 2.7.6.1 (5-phospho-D-ribosyl alpha-1-diphosphate) (Phosphoribosyl diphosphate synthase) (Phosphoribosyl pyrophosphate synthase, P-Rib-PP synthase, PRPP synthase, PRPPase)",prs prsA STM1780,Salmonella typhimurium (strain LT2 / SGSC1412 / ATCC 700720),315,prs,,prsA
P0A251,reviewed,AHPC_SALTY,"Alkyl hydroperoxide reductase C, EC 1.11.1.26 (Alkyl hydroperoxide reductase protein C22) (Peroxiredoxin) (Thioredoxin peroxidase)",ahpC STM0608,Salmonella typhimurium (strain LT2 / SGSC1412 / ATCC 700720),187,ahpC,,
P0A277,reviewed,XGPT_SALTY,"Xanthine-guanine phosphoribosyltransferase, XGPRT, EC 2.4.2.-, EC 2.4.2.22 (Xanthine phosphoribosyltransferase)",gpt STM0317,Salmonella typhimurium (strain LT2 / SGSC1412 / ATCC 700720),152,gpt,,
P0A283,reviewed,PTGA_SALTY,PTS system glucose-specific EIIA component (EIIA-Glc) (EIII-Glc) (Glucose-specific phosphotransferase enzyme IIA component),crr STM2433,Salmonella typhimurium (strain LT2 / SGSC1412 / ATCC 700720),169,crr,,
P0A2D5,reviewed,CHEY_SALTY,Chemotaxis protein CheY,cheY STM1916,Salmonella typhimurium (strain LT2 / SGSC1412 / ATCC 700720),129,cheY,,
P0A2E1,reviewed,GLYA_SALTY,"Serine hydroxymethyltransferase, SHMT, Serine methylase, EC 2.1.2.1",glyA STM2555,Salmonella typhimurium (strain LT2 / SGSC1412 / ATCC 700720),417,glyA,,
P0A2F2,reviewed,NPD_SALTY,"NAD-dependent protein deacylase, EC 2.3.1.286 (Regulatory protein SIR2 homolog)",cobB STM1221,Salmonella typhimurium (strain LT2 / SGSC1412 / ATCC 700720),273,cobB,,
P0A2I3,reviewed,GYRB_SALTY,"DNA gyrase subunit B, EC 5.6.2.2",gyrB STM3835,Salmonella typhimurium (strain LT2 / SGSC1412 / ATCC 700720),804,gyrB,,
P0A2K1,reviewed,TRPB_SALTY,"Tryptophan synthase beta chain, EC 4.2.1.20",trpB STM1726,Salmonella typhimurium (strain LT2 / SGSC1412 / ATCC 700720),397,trpB,,
P0A2R8,reviewed,CORA_SALTY,Magnesium transport protein CorA,corA STM3952 STMD1.38,Salmonella typhimurium (strain LT2 / SGSC1412 / ATCC 700720),316,corA,STMD1.38,
P0CE12,reviewed,SSPH2_SALTY,"E3 ubiquitin-protein ligase SspH2, EC 2.3.2.27 (RING-type E3 ubiquitin transferase SspH2) (Salmonella secreted protein H2) (Secreted effector protein sspH2)",sspH2 STM2241,Salmonella typhimurium (strain LT2 / SGSC1412 / ATCC 700720),788,sspH2,,
P0CW86,reviewed,SODC1_SALTY,"Superoxide dismutase [Cu-Zn] 1, EC 1.15.1.1 (sodCI)",sodC1 sodC STM1044,Salmonella typhimurium (strain LT2 / SGSC1412 / ATCC 700720),177,sodC1,,sodC
P0DM80,reviewed,PHOQ_SALTY,"Virulence sensor histidine kinase PhoQ, EC 2.7.13.3, EC 3.1.3.- (Sensor histidine protein kinase/phosphatase PhoQ)",phoQ phoZ STM1230,Salmonella typhimurium (strain LT2 / SGSC1412 / ATCC 700720),487,phoQ,,phoZ
P10370,reviewed,HISX_SALTY,"Histidinol dehydrogenase, HDH, EC 1.1.1.23",hisD STM2072,Salmonella typhimurium (strain LT2 / SGSC1412 / ATCC 700720),434,hisD,,
P10503,reviewed,PUTA_SALTY,"Bifunctional protein PutA [Includes: Proline dehydrogenase, EC 1.5.5.2 (Proline oxidase); Delta-1-pyrroline-5-carboxylate dehydrogenase, P5C dehydrogenase, EC 1.2.1.88 (L-glutamate gamma-semialdehyde dehydrogenase) ]",putA STM1124,Salmonella typhimurium (strain LT2 / SGSC1412 / ATCC 700720),1320,putA,,
P11954,reviewed,TDCB_SALTY,"L-threonine dehydratase catabolic TdcB, EC 4.3.1.19 (L-serine dehydratase, EC 4.3.1.17) (Threonine deaminase)",tdcB STM3244,Salmonella typhimurium (strain LT2 / SGSC1412 / ATCC 700720),329,tdcB,,
P19264,reviewed,EUTB_SALTY,"Ethanolamine ammonia-lyase large subunit, EAL large subunit, EC 4.3.1.7 (Ethanolamine ammonia-lyase alpha subunit) (Ethanolamine ammonia-lyase heavy chain)",eutB STM2458,Salmonella typhimurium (strain LT2 / SGSC1412 / ATCC 700720),453,eutB,,
P19265,reviewed,EUTC_SALTY,"Ethanolamine ammonia-lyase small subunit, EAL small subunit, EC 4.3.1.7 (Ethanolamine ammonia-lyase beta subunit)",eutC STM2457,Salmonella typhimurium (strain LT2 / SGSC1412 / ATCC 700720),298,eutC,,
P22036,reviewed,ATMB_SALTY,"Magnesium-transporting ATPase, P-type 1, EC 7.2.2.14 (Mg(2+) transport ATPase, P-type 1)",mgtB STM3763,Salmonella typhimurium (strain LT2 / SGSC1412 / ATCC 700720),908,mgtB,,
P24518,reviewed,NADR_SALTY,"Trifunctional NAD biosynthesis/regulator protein NadR [Includes: Transcriptional regulator NadR; Nicotinamide mononucleotide adenylyltransferase, NMN adenylyltransferase, NMN-AT, NMNAT, EC 2.7.7.1 (Nicotinamide ribonucleotide adenylyltransferase) (Nicotinamide-nucleotide adenylyltransferase); Ribosylnicotinamide kinase, RNK, EC 2.7.1.22 (Nicotinamide riboside kinase, NRK, NmR-K) ]",nadR nadI pnuA STM4580,Salmonella typhimurium (strain LT2 / SGSC1412 / ATCC 700720),410,nadR,,nadI pnuA
P25924,reviewed,CYSG_SALTY,"Siroheme synthase [Includes: Uroporphyrinogen-III C-methyltransferase, Urogen III methylase, EC 2.1.1.107 (SUMT) (Uroporphyrinogen III methylase, UROM); Precorrin-2 dehydrogenase, EC 1.3.1.76; Sirohydrochlorin ferrochelatase, EC 4.99.1.4 ]",cysG STM3477,Salmonella typhimurium (strain LT2 / SGSC1412 / ATCC 700720),457,cysG,,
P26311,reviewed,PEPT_SALTY,"Peptidase T, EC 3.4.11.4 (Aminotripeptidase, Tripeptidase) (Tripeptide aminopeptidase)",pepT STM1227,Salmonella typhimurium (strain LT2 / SGSC1412 / ATCC 700720),409,pepT,,
P26353,reviewed,HMP_SALTY,"Flavohemoprotein (Flavohemoglobin) (Hemoglobin-like protein) (Nitric oxide dioxygenase, NO oxygenase, NOD, EC 1.14.12.17)",hmp frsB hmpA STM2556,Salmonella typhimurium (strain LT2 / SGSC1412 / ATCC 700720),396,hmp,,frsB hmpA
P26391,reviewed,RMLB_SALTY,"dTDP-glucose 4,6-dehydratase, EC 4.2.1.46",rfbB STM2097,Salmonella typhimurium (strain LT2 / SGSC1412 / ATCC 700720),361,rfbB,,
P26392,reviewed,RMLD_SALTY,"dTDP-4-dehydrorhamnose reductase, EC 1.1.1.133 (dTDP-4-keto-L-rhamnose reductase) (dTDP-6-deoxy-L-lyxo-4-hexulose reductase) (dTDP-6-deoxy-L-mannose dehydrogenase) (dTDP-L-rhamnose synthase)",rfbD rmlD STM2096,Salmonella typhimurium (strain LT2 / SGSC1412 / ATCC 700720),299,rfbD,,rmlD
P26393,reviewed,RMLA_SALTY,"Glucose-1-phosphate thymidylyltransferase, EC 2.7.7.24 (dTDP-glucose pyrophosphorylase, Ep) (dTDP-glucose synthase)",rmlA rfbA STM2095,Salmonella typhimurium (strain LT2 / SGSC1412 / ATCC 700720),292,rmlA,,rfbA
P26394,reviewed,RMLC_SALTY,"dTDP-4-dehydrorhamnose 3,5-epimerase, EC 5.1.3.13 (Thymidine diphospho-4-keto-rhamnose 3,5-epimerase) (dTDP-4-keto-6-deoxyglucose 3,5-epimerase) (dTDP-6-deoxy-D-xylo-4-hexulose 3,5-epimerase) (dTDP-L-rhamnose synthase)",rfbC rmlC STM2094,Salmonella typhimurium (strain LT2 / SGSC1412 / ATCC 700720),183,rfbC,,rmlC
P26465,reviewed,FLII_SALTY,"Flagellum-specific ATP synthase, EC 7.1.2.2",fliI fla AIII flaC STM1972,Salmonella typhimurium (strain LT2 / SGSC1412 / ATCC 700720),456,fliI,,fla AIII flaC
P26466,reviewed,LAMB_SALTY,Maltoporin (Maltose-inducible porin),lamB malL STM4231,Salmonella typhimurium (strain LT2 / SGSC1412 / ATCC 700720),452,lamB,,malL
P29768,reviewed,NANH_SALTY,"Sialidase, EC 3.2.1.18 (N-acylneuraminate glycohydrolase) (Neuraminidase, NANase) (STNA)",nanH STM0928,Salmonella typhimurium (strain LT2 / SGSC1412 / ATCC 700720),382,nanH,,
P29946,reviewed,CBIA_SALTY,"Cobyrinate a,c-diamide synthase, EC 6.3.5.11 (Cobyrinic acid a,c-diamide synthetase) [Cleaved into: Cobyrinate a,c-diamide synthase, N-terminally processed ]",cbiA STM2035,Salmonella typhimurium (strain LT2 / SGSC1412 / ATCC 700720),459,cbiA,,
P30878,reviewed,MELB_SALTY,Melibiose permease (Melibiose carrier) (Melibiose transporter) (Melibiose/cation symporter) (Na+ (Li+)/melibiose symporter) (Thiomethylgalactoside permease II),melB STM4299,Salmonella typhimurium (strain LT2 / SGSC1412 / ATCC 700720),476,melB,,
P37412,reviewed,LEU3_SALTY,"3-isopropylmalate dehydrogenase, EC 1.1.1.85 (3-IPM-DH) (Beta-IPM dehydrogenase, IMDH)",leuB STM0112,Salmonella typhimurium (strain LT2 / SGSC1412 / ATCC 700720),363,leuB,,
P37426,reviewed,RIR1_SALTY,"Ribonucleoside-diphosphate reductase 1 subunit alpha, EC 1.17.4.1 (Protein B1) (Ribonucleoside-diphosphate reductase 1 R1 subunit) (Ribonucleotide reductase 1)",nrdA STM2277,Salmonella typhimurium (strain LT2 / SGSC1412 / ATCC 700720),761,nrdA,,
P37449,reviewed,PDUB_SALTY,"Bacterial microcompartment shell protein PduB (Bacterial microcompartment protein homotrimer, BMC-T) (Propanediol utilization protein PduB)",pduB STM2039,Salmonella typhimurium (strain LT2 / SGSC1412 / ATCC 700720),270,pduB,,
P37450,reviewed,PDUC_SALTY,"Propanediol dehydratase large subunit, EC 4.2.1.28 (Diol dehydratase large subunit, DDH large subunit) (Propanediol utilization protein PduC)",pduC STM2040,Salmonella typhimurium (strain LT2 / SGSC1412 / ATCC 700720),554,pduC,,
P40193,reviewed,PTSJ_SALTY,Vitamin B6 salvage pathway transcriptional repressor PtsJ (HTH-type transcriptional regulatory protein PtsJ),ptsJ STM2436,Salmonella typhimurium (strain LT2 / SGSC1412 / ATCC 700720),430,ptsJ,,
P40732,reviewed,ARGD_SALTY,"Acetylornithine/succinyldiaminopimelate aminotransferase, ACOAT, DapATase, Succinyldiaminopimelate transferase, EC 2.6.1.11, EC 2.6.1.17",argD dapC dtu STM3468,Salmonella typhimurium (strain LT2 / SGSC1412 / ATCC 700720),405,argD,,dapC dtu
P40811,reviewed,ILVI_SALTY,"Acetolactate synthase isozyme 3 large subunit, EC 2.2.1.6 (AHAS-III) (ALS-III) (Acetohydroxy-acid synthase III large subunit)",ilvI STM0116,Salmonella typhimurium (strain LT2 / SGSC1412 / ATCC 700720),574,ilvI,,
P40817,reviewed,DPAL_SALTY,"Diaminopropionate ammonia-lyase, DAPAL, EC 4.3.1.15 (2,3-diaminopropionate ammonia-lyase) (Alpha,beta-diaminopropionate ammonia-lyase) (Diaminopropionatase)",dpaL STM1002,Salmonella typhimurium (strain LT2 / SGSC1412 / ATCC 700720),404,dpaL,,
P41780,reviewed,APBE_SALTY,"FAD:protein FMN transferase, EC 2.7.1.180 (Flavin transferase)",apbE STM2266,Salmonella typhimurium (strain LT2 / SGSC1412 / ATCC 700720),350,apbE,,
P41791,reviewed,EUTM_SALTY,"Bacterial microcompartment shell protein EutM (Bacterial microcompartment protein homohexamer, BMC-H) (Ethanolamine utilization protein EutM)",eutM cchA STM2465,Salmonella typhimurium (strain LT2 / SGSC1412 / ATCC 700720),96,eutM,,cchA
P41793,reviewed,EUTE_SALTY,"Acetaldehyde dehydrogenase (acetylating) EutE, EC 1.2.1.10 (Ethanolamine utilization protein EutE)",eutE STM2463,Salmonella typhimurium (strain LT2 / SGSC1412 / ATCC 700720),467,eutE,,
P51067,reviewed,ACEK_SALTY,"Isocitrate dehydrogenase kinase/phosphatase, IDH kinase/phosphatase, IDHK/P, EC 2.7.11.5, EC 3.1.3.-",aceK STM4185,Salmonella typhimurium (strain LT2 / SGSC1412 / ATCC 700720),583,aceK,,
P55880,reviewed,YAJL_SALTY,"Protein/nucleic acid deglycase YajL, EC 3.1.2.-, EC 3.5.1.-, EC 3.5.1.124 (Chaperone protein YajL) (Maillard deglycase)",yajL STM0433,Salmonella typhimurium (strain LT2 / SGSC1412 / ATCC 700720),196,yajL,,
P58683,reviewed,APHA_SALTY,"Class B acid phosphatase, CBAP, EC 3.1.3.2 (Non-specific acid phosphatase II)",aphA STM4249,Salmonella typhimurium (strain LT2 / SGSC1412 / ATCC 700720),237,aphA,,
P58687,reviewed,AROD_SALTY,"3-dehydroquinate dehydratase, 3-dehydroquinase, DHQD, EC 4.2.1.10 (Type I DHQase) (Type I dehydroquinase, DHQ1)",aroD STM1358,Salmonella typhimurium (strain LT2 / SGSC1412 / ATCC 700720),252,aroD,,
P63411,reviewed,ACKA_SALTY,"Acetate kinase AckA, EC 2.7.2.1 (Acetokinase)",ackA STM2337,Salmonella typhimurium (strain LT2 / SGSC1412 / ATCC 700720),400,ackA,,
P65774,reviewed,NADK_SALTY,"NAD kinase, EC 2.7.1.23 (ATP-dependent NAD kinase)",nadK STM2683,Salmonella typhimurium (strain LT2 / SGSC1412 / ATCC 700720),292,nadK,,
P65921,reviewed,PYRG_SALTY,"CTP synthase, EC 6.3.4.2 (Cytidine 5'-triphosphate synthase) (Cytidine triphosphate synthetase, CTP synthetase, CTPS) (UTP--ammonia ligase)",pyrG STM2953,Salmonella typhimurium (strain LT2 / SGSC1412 / ATCC 700720),545,pyrG,,
P74857,reviewed,SCTN2_SALTY,"SPI-2 type 3 secretion system ATPase, T3SS-2 ATPase, EC 7.4.2.8",sctN2 ssaN STM1415,Salmonella typhimurium (strain LT2 / SGSC1412 / ATCC 700720),433,sctN2,,ssaN
P74873,reviewed,SPTP_SALTY,"Secreted effector protein SptP [Includes: GTPase-activating protein, GAP; Tyrosine-protein phosphatase, EC 3.1.3.48 ]",sptP STM2878,Salmonella typhimurium (strain LT2 / SGSC1412 / ATCC 700720),543,sptP,,
P74881,reviewed,PUR4_SALTY,"Phosphoribosylformylglycinamidine synthase, FGAM synthase, FGAMS, EC 6.3.5.3 (Formylglycinamide ribonucleotide amidotransferase, FGAR amidotransferase, FGAR-AT)",purL STM2565,Salmonella typhimurium (strain LT2 / SGSC1412 / ATCC 700720),1295,purL,,
P77983,reviewed,KPYK1_SALTY,"Pyruvate kinase I, EC 2.7.1.40 (PK-1)",pykF STM1378,Salmonella typhimurium (strain LT2 / SGSC1412 / ATCC 700720),470,pykF,,
P96060,reviewed,PHNW_SALTY,"2-aminoethylphosphonate--pyruvate transaminase, EC 2.6.1.37 (2-aminoethylphosphonate aminotransferase) (AEP transaminase, AEPT)",phnW STM0431,Salmonella typhimurium (strain LT2 / SGSC1412 / ATCC 700720),367,phnW,,
P97084,reviewed,COBD_SALTY,"Threonine-phosphate decarboxylase, EC 4.1.1.81 (L-threonine-O-3-phosphate decarboxylase)",cobD STM0644,Salmonella typhimurium (strain LT2 / SGSC1412 / ATCC 700720),364,cobD,,
Q05592,reviewed,CBIK_SALTY,"Sirohydrochlorin cobaltochelatase, EC 4.99.1.3",cbiK STM2025,Salmonella typhimurium (strain LT2 / SGSC1412 / ATCC 700720),264,cbiK,,
Q05599,reviewed,COBU_SALTY,"Bifunctional adenosylcobalamin biosynthesis protein CobU (Adenosylcobinamide kinase, EC 2.7.1.156) (Adenosylcobinamide-phosphate guanylyltransferase, EC 2.7.7.62)",cobU STM2018,Salmonella typhimurium (strain LT2 / SGSC1412 / ATCC 700720),181,cobU,,
Q05603,reviewed,COBT_SALTY,"Nicotinate-nucleotide--dimethylbenzimidazole phosphoribosyltransferase, NN:DBI PRT, EC 2.4.2.21 (N(1)-alpha-phosphoribosyltransferase)",cobT STM2016,Salmonella typhimurium (strain LT2 / SGSC1412 / ATCC 700720),356,cobT,,
Q08698,reviewed,RIR3_SALTY,"Ribonucleoside-diphosphate reductase 2 subunit alpha, EC 1.17.4.1 (R1E protein) (Ribonucleotide reductase 2)",nrdE STM2807,Salmonella typhimurium (strain LT2 / SGSC1412 / ATCC 700720),714,nrdE,,
Q56061,reviewed,SIFA_SALTY,Secreted effector protein SifA,sifA STM1224,Salmonella typhimurium (strain LT2 / SGSC1412 / ATCC 700720),336,sifA,,
Q56062,reviewed,PRPB_SALTY,"2-methylisocitrate lyase, 2-MIC, MICL, EC 4.1.3.30 ((2R,3S)-2-methylisocitrate lyase)",prpB STM0368,Salmonella typhimurium (strain LT2 / SGSC1412 / ATCC 700720),295,prpB,,
Q56063,reviewed,PRPC_SALTY,"2-methylcitrate synthase, 2-MCS, mcs, EC 2.3.3.5 (Citrate synthase, EC 2.3.3.16)",prpC STM0369,Salmonella typhimurium (strain LT2 / SGSC1412 / ATCC 700720),389,prpC,,
Q7CP78,reviewed,RIDA_SALTY,"2-iminobutanoate/2-iminopropanoate deaminase, EC 3.5.99.10 (Enamine/imine deaminase)",ridA yjgF STM4458,Salmonella typhimurium (strain LT2 / SGSC1412 / ATCC 700720),128,ridA,,yjgF
Q7CPR9,reviewed,HLDE_SALTY,"Bifunctional protein HldE [Includes: D-beta-D-heptose 7-phosphate kinase, EC 2.7.1.167 (D-beta-D-heptose 7-phosphotransferase) (D-glycero-beta-D-manno-heptose-7-phosphate kinase); D-beta-D-heptose 1-phosphate adenylyltransferase, EC 2.7.7.70 (D-glycero-beta-D-manno-heptose 1-phosphate adenylyltransferase) ]",hldE rfaE waaE STM3200,Salmonella typhimurium (strain LT2 / SGSC1412 / ATCC 700720),477,hldE,,rfaE waaE
Q8ZJV7,reviewed,DEOD_SALTY,"Purine nucleoside phosphorylase DeoD-type, PNP, EC 2.4.2.1",deoD STM4570,Salmonella typhimurium (strain LT2 / SGSC1412 / ATCC 700720),239,deoD,,
Q8ZKA7,unreviewed,Q8ZKA7_SALTY,"Bifunctional NAD(P)H-hydrate repair enzyme (Nicotinamide nucleotide repair protein) [Includes: ADP-dependent (S)-NAD(P)H-hydrate dehydratase, EC 4.2.1.136 (ADP-dependent NAD(P)HX dehydratase); NAD(P)H-hydrate epimerase, EC 5.1.99.6 ]",yjeF nnrD nnrE STM4356,Salmonella typhimurium (strain LT2 / SGSC1412 / ATCC 700720),515,yjeF,,nnrD nnrE
Q8ZKE6,reviewed,PHNO_SALTY,"Aminoalkylphosphonate N-acetyltransferase, EC 2.3.1.280",phnO STM4287,Salmonella typhimurium (strain LT2 / SGSC1412 / ATCC 700720),154,phnO,,
Q8ZKF6,reviewed,ACSA_SALTY,"Acetyl-coenzyme A synthetase, AcCoA synthetase, Acs, EC 6.2.1.1 (Acetate--CoA ligase) (Acyl-activating enzyme)",acs STM4275,Salmonella typhimurium (strain LT2 / SGSC1412 / ATCC 700720),652,acs,,
Q8ZKR2,reviewed,AIRSK_SALTY,"Aminoimidazole riboside kinase, AIRs kinase, EC 2.7.1.223",STM4066,Salmonella typhimurium (strain LT2 / SGSC1412 / ATCC 700720),319,,,
Q8ZL58,reviewed,TAGAD_SALTY,"L-talarate/galactarate dehydratase, TalrD/GalrD, EC 4.2.1.156, EC 4.2.1.42 (StTGD)",STM3697,Salmonella typhimurium (strain LT2 / SGSC1412 / ATCC 700720),398,,,
Q8ZMX2,reviewed,LYSAC_SALTY,"Peptidyl-lysine N-acetyltransferase Pat, EC 2.3.1.- (Protein lysine acetyltransferase)",pat yfiQ STM2651,Salmonella typhimurium (strain LT2 / SGSC1412 / ATCC 700720),886,pat,,yfiQ
Q8ZN75,reviewed,DAPE_SALTY,"Succinyl-diaminopimelate desuccinylase, SDAP desuccinylase, EC 3.5.1.18 (Aspartyl peptidase) (N-succinyl-LL-2,6-diaminoheptanedioate amidohydrolase)",dapE STM2483,Salmonella typhimurium (strain LT2 / SGSC1412 / ATCC 700720),375,dapE,,
Q8ZND6,reviewed,PTA_SALTY,"Phosphate acetyltransferase, EC 2.3.1.222, EC 2.3.1.8 (Phosphotransacetylase)",pta STM2338,Salmonella typhimurium (strain LT2 / SGSC1412 / ATCC 700720),714,pta,,
Q8ZNF3,reviewed,ARNB_SALTY,"UDP-4-amino-4-deoxy-L-arabinose--oxoglutarate aminotransferase, EC 2.6.1.87 (Polymyxin resistance protein PmrH) (UDP-(beta-L-threo-pentapyranosyl-4''-ulose diphosphate) aminotransferase, UDP-Ara4O aminotransferase) (UDP-4-amino-4-deoxy-L-arabinose aminotransferase)",arnB pbgP pbgP1 pmrH STM2297,Salmonella typhimurium (strain LT2 / SGSC1412 / ATCC 700720),385,arnB,,pbgP pbgP1 pmrH
Q8ZNF5,reviewed,NUDI_SALTY,"Nucleoside triphosphatase NudI, EC 3.6.1.9 (Nucleotide diphosphatase NudI) (Pyrimidine deoxynucleoside triphosphate diphosphatase) (dCTP diphosphatase, EC 3.6.1.12) (dTTP diphosphatase, EC 3.6.1.-) (dUTP diphosphatase, EC 3.6.1.23)",nudI STM2295,Salmonella typhimurium (strain LT2 / SGSC1412 / ATCC 700720),141,nudI,,
Q8ZNF9,reviewed,RHMD_SALTY,"L-rhamnonate dehydratase, RhamD, EC 4.2.1.90",rhmD yfaW STM2291,Salmonella typhimurium (strain LT2 / SGSC1412 / ATCC 700720),405,rhmD,,yfaW
Q8ZNR3,reviewed,SOPA_SALTY,"E3 ubiquitin-protein ligase SopA, EC 2.3.2.26 (HECT-type E3 ubiquitin transferase SopA) (Salmonella outer protein A) (Secreted effector protein SopA)",sopA STM2066,Salmonella typhimurium (strain LT2 / SGSC1412 / ATCC 700720),782,sopA,,
Q8ZNR5,reviewed,PDUO_SALTY,"Corrinoid adenosyltransferase PduO, EC 2.5.1.- (ATP:co(I)rrinoid adenosyltransferase PduO, ACA) (Propanediol utilization protein PduO)",pduO STM2050,Salmonella typhimurium (strain LT2 / SGSC1412 / ATCC 700720),336,pduO,,
Q8ZNW0,reviewed,KPYK2_SALTY,"Pyruvate kinase II, EC 2.7.1.40 (PK-2)",pykA STM1888,Salmonella typhimurium (strain LT2 / SGSC1412 / ATCC 700720),480,pykA,,
Q8ZP52,reviewed,ACNA_SALTY,"Aconitate hydratase A, ACN, Aconitase, EC 4.2.1.3 ((2R,3S)-2-methylisocitrate dehydratase) ((2S,3R)-3-hydroxybutane-1,2,3-tricarboxylate dehydratase) (2-methyl-cis-aconitate hydratase, EC 4.2.1.99) (Iron-responsive protein-like, IRP-like) (RNA-binding protein)",acnA STM1712,Salmonella typhimurium (strain LT2 / SGSC1412 / ATCC 700720),891,acnA,,
Q8ZPD3,reviewed,MDDA_SALTY,"L-methionine sulfoximine/L-methionine sulfone acetyltransferase, EC 2.3.1.- (L-amino acid N-acyltransferase, EC 2.3.1.-) (Methionine derivative detoxifier A, MDDA)",yncA STM1590,Salmonella typhimurium (strain LT2 / SGSC1412 / ATCC 700720),171,yncA,,
Q8ZPX9,reviewed,S3AD_SALTY,"Aminoglycoside (3'') (9) adenylyltransferase, EC 2.7.7.47 (AadA) (Aminoglycoside nucleotidyltransferase (3'') (9) adenyltransferase, ANT(3'') (9) adenyltransferase)",aadA STM1264,Salmonella typhimurium (strain LT2 / SGSC1412 / ATCC 700720),262,aadA,,
Q8ZQ06,reviewed,NAGZ_SALTY,"Beta-hexosaminidase, EC 3.2.1.52 (Beta-N-acetylhexosaminidase) (N-acetyl-beta-glucosaminidase)",nagZ STM1209,Salmonella typhimurium (strain LT2 / SGSC1412 / ATCC 700720),341,nagZ,,
Q8ZQQ2,reviewed,SLRP_SALTY,"E3 ubiquitin-protein ligase SlrP, EC 2.3.2.27 (RING-type E3 ubiquitin transferase SlrP) (Secreted effector protein SlrP)",slrP STM0800,Salmonella typhimurium (strain LT2 / SGSC1412 / ATCC 700720),765,slrP,,
Q8ZR06,reviewed,PAGP_SALTY,"Lipid A palmitoyltransferase PagP, EC 2.3.1.251 (Antimicrobial peptide resistance) (Lipid A acylation protein)",pagP STM0628,Salmonella typhimurium (strain LT2 / SGSC1412 / ATCC 700720),190,pagP,,
Q8ZR88,reviewed,SELU_SALTY,"tRNA 2-selenouridine synthase, EC 2.9.1.3 (Selenophosphate-dependent tRNA 2-selenouridine synthase)",selU mnmH STM0513,Salmonella typhimurium (strain LT2 / SGSC1412 / ATCC 700720),364,selU,,mnmH
